{
  "$schema": "http://json-schema.org/draft-07/schema#",
  "$id": "https://autodev/skills/pixel-animation-artist/animation.schema.json",
  "title": "AutoDev Pixel Animation Manifest",
  "description": "Runtime-agnostic description of a pixel animation. The sprite sheet holds ONLY frame images; everything about how the animation plays (order, timing, motion, events, loop, priority) lives here so the same art can be driven differently by different runtimes.",
  "type": "object",
  "required": ["id", "spriteSheet", "frameWidth", "frameHeight", "frames"],
  "additionalProperties": true,
  "properties": {
    "id": {
      "type": "string",
      "description": "Stable identifier, e.g. \"curious_magnifier\".",
      "minLength": 1
    },
    "spriteSheet": {
      "type": "string",
      "description": "Relative path to the sprite-sheet PNG that contains every frame image."
    },
    "frameWidth": { "type": "integer", "minimum": 1, "description": "Width of a single frame in pixels (default 64)." },
    "frameHeight": { "type": "integer", "minimum": 1, "description": "Height of a single frame in pixels (default 32)." },
    "columns": { "type": "integer", "minimum": 1, "description": "Number of frame columns in the sprite sheet." },
    "rows": { "type": "integer", "minimum": 1, "description": "Number of frame rows in the sprite sheet." },
    "loop": { "type": "boolean", "default": true, "description": "Whether playback repeats after the last frame." },
    "priority": {
      "type": "integer",
      "description": "Higher wins when two animations compete for the same sprite. Advisory to the runtime."
    },
    "interruptible": {
      "type": "boolean",
      "default": true,
      "description": "Whether a higher-priority animation may cut this one off mid-play."
    },
    "frames": {
      "type": "array",
      "minItems": 1,
      "description": "Ordered playlist. Each entry references a cell of the sprite sheet by index and gives its on-screen duration. The array order IS the play order; the same index may appear more than once.",
      "items": {
        "type": "object",
        "required": ["index", "durationMs"],
        "additionalProperties": true,
        "properties": {
          "index": { "type": "integer", "minimum": 0, "description": "Zero-based frame index into the sprite sheet (row-major)." },
          "durationMs": { "type": "integer", "minimum": 1, "description": "How long this frame is shown, in milliseconds." }
        }
      }
    },
    "motion": {
      "type": "array",
      "description": "Keyframed transform of the WHOLE sprite over time (tween). The runtime interpolates between successive keyframes using each keyframe's easing. Independent of the frame flip-book.",
      "items": {
        "type": "object",
        "required": ["timeMs"],
        "additionalProperties": true,
        "properties": {
          "timeMs": { "type": "integer", "minimum": 0 },
          "x": { "type": "number", "default": 0 },
          "y": { "type": "number", "default": 0 },
          "scale": { "type": "number", "default": 1.0 },
          "rotation": { "type": "number", "default": 0, "description": "Degrees." },
          "alpha": { "type": "number", "minimum": 0, "maximum": 1, "default": 1.0 },
          "easing": {
            "type": "string",
            "enum": ["linear", "easeIn", "easeOut", "easeInOut", "step"],
            "default": "linear"
          }
        }
      }
    },
    "events": {
      "type": "array",
      "description": "Timeline events fired at the given time offset (sound cue, particle/effect, gameplay callback, ...).",
      "items": {
        "type": "object",
        "required": ["timeMs", "type", "value"],
        "additionalProperties": true,
        "properties": {
          "timeMs": { "type": "integer", "minimum": 0 },
          "type": {
            "type": "string",
            "enum": ["sound", "effect", "callback"]
          },
          "value": { "type": "string" }
        }
      }
    }
  }
}
